{
  "$schema": "./schemas/skill-registry.schema.json",
  "name": "agent-publishing-skills",
  "version": "0.2.0",
  "skills": [
    {
      "name": "planner",
      "path": "skills/planner/SKILL.md",
      "input_schema": "schemas/project-brief.schema.json",
      "output_schema": "schemas/publishing-plan.schema.json",
      "knowledge": [
        "knowledge/index.json",
        "knowledge/rules/anti-spam.md",
        "knowledge/rules/no-auto-publish.md",
        "knowledge/rules/disclosure.md",
        "knowledge/rules/factual-accuracy.md"
      ]
    },
    {
      "name": "writer",
      "path": "skills/writer/SKILL.md",
      "input_schema": "schemas/project-brief.schema.json",
      "output_schema": "schemas/platform-draft.schema.json",
      "knowledge": [
        "knowledge/rules/anti-spam.md",
        "knowledge/rules/no-auto-publish.md",
        "knowledge/rules/disclosure.md",
        "knowledge/rules/factual-accuracy.md"
      ]
    },
    {
      "name": "reviewer",
      "path": "skills/reviewer/SKILL.md",
      "input_schema": "schemas/platform-draft.schema.json",
      "output_schema": "schemas/review-result.schema.json",
      "knowledge": [
        "knowledge/platforms/<target-platform>.md",
        "knowledge/rules/anti-spam.md",
        "knowledge/rules/no-auto-publish.md",
        "knowledge/rules/disclosure.md",
        "knowledge/rules/factual-accuracy.md"
      ]
    },
    {
      "name": "adapter-technical-blog",
      "path": "skills/adapter-technical-blog/SKILL.md",
      "input_schema": "schemas/platform-draft.schema.json",
      "output_schema": "schemas/platform-draft.schema.json",
      "knowledge": [
        "knowledge/platforms/<target-platform>.md",
        "knowledge/rules/anti-spam.md",
        "knowledge/rules/no-auto-publish.md",
        "knowledge/rules/disclosure.md",
        "knowledge/rules/factual-accuracy.md"
      ]
    },
    {
      "name": "adapter-community-discussion",
      "path": "skills/adapter-community-discussion/SKILL.md",
      "input_schema": "schemas/platform-draft.schema.json",
      "output_schema": "schemas/platform-draft.schema.json",
      "knowledge": [
        "knowledge/platforms/<target-platform>.md",
        "knowledge/rules/anti-spam.md",
        "knowledge/rules/no-auto-publish.md",
        "knowledge/rules/disclosure.md",
        "knowledge/rules/factual-accuracy.md"
      ]
    },
    {
      "name": "adapter-launch",
      "path": "skills/adapter-launch/SKILL.md",
      "input_schema": "schemas/platform-draft.schema.json",
      "output_schema": "schemas/platform-draft.schema.json",
      "knowledge": [
        "knowledge/platforms/<target-platform>.md",
        "knowledge/rules/anti-spam.md",
        "knowledge/rules/no-auto-publish.md",
        "knowledge/rules/disclosure.md",
        "knowledge/rules/factual-accuracy.md"
      ]
    },
    {
      "name": "adapter-showcase",
      "path": "skills/adapter-showcase/SKILL.md",
      "input_schema": "schemas/platform-draft.schema.json",
      "output_schema": "schemas/platform-draft.schema.json",
      "knowledge": [
        "knowledge/platforms/<target-platform>.md",
        "knowledge/rules/anti-spam.md",
        "knowledge/rules/no-auto-publish.md",
        "knowledge/rules/disclosure.md",
        "knowledge/rules/factual-accuracy.md"
      ]
    },
    {
      "name": "adapter-social-shortform",
      "path": "skills/adapter-social-shortform/SKILL.md",
      "input_schema": "schemas/platform-draft.schema.json",
      "output_schema": "schemas/platform-draft.schema.json",
      "knowledge": [
        "knowledge/platforms/<target-platform>.md",
        "knowledge/rules/anti-spam.md",
        "knowledge/rules/no-auto-publish.md",
        "knowledge/rules/disclosure.md",
        "knowledge/rules/factual-accuracy.md"
      ]
    }
  ],
  "platform_knowledge": [
    {
      "slug": "a-list-apart",
      "path": "knowledge/platforms/a-list-apart.md",
      "recommended_adapter": "adapter-showcase",
      "primary_language": "en",
      "categories": [
        "showcase"
      ],
      "target_audience": "developers"
    },
    {
      "slug": "alura",
      "path": "knowledge/platforms/alura.md",
      "recommended_adapter": "adapter-technical-blog",
      "primary_language": "pt",
      "categories": [
        "technical-blog"
      ],
      "target_audience": "developers"
    },
    {
      "slug": "andela",
      "path": "knowledge/platforms/andela.md",
      "recommended_adapter": "adapter-technical-blog",
      "primary_language": "en",
      "categories": [
        "technical-blog"
      ],
      "target_audience": "developers"
    },
    {
      "slug": "arab-hardware",
      "path": "knowledge/platforms/arab-hardware.md",
      "recommended_adapter": "adapter-technical-blog",
      "primary_language": "ar",
      "categories": [
        "technical-blog"
      ],
      "target_audience": "developers"
    },
    {
      "slug": "arena",
      "path": "knowledge/platforms/arena.md",
      "recommended_adapter": "adapter-showcase",
      "primary_language": "en",
      "categories": [
        "showcase"
      ],
      "target_audience": "designers"
    },
    {
      "slug": "atlassian-community",
      "path": "knowledge/platforms/atlassian-community.md",
      "recommended_adapter": "adapter-technical-blog",
      "primary_language": "en",
      "categories": [
        "technical-blog"
      ],
      "target_audience": "developers"
    },
    {
      "slug": "awesome-lists",
      "path": "knowledge/platforms/awesome-lists.md",
      "recommended_adapter": "adapter-showcase",
      "primary_language": "en",
      "categories": [
        "showcase"
      ],
      "target_audience": "developers"
    },
    {
      "slug": "awwwards",
      "path": "knowledge/platforms/awwwards.md",
      "recommended_adapter": "adapter-showcase",
      "primary_language": "en",
      "categories": [
        "showcase"
      ],
      "target_audience": "designers"
    },
    {
      "slug": "behance",
      "path": "knowledge/platforms/behance.md",
      "recommended_adapter": "adapter-showcase",
      "primary_language": "en",
      "categories": [
        "showcase"
      ],
      "target_audience": "designers"
    },
    {
      "slug": "brunch",
      "path": "knowledge/platforms/brunch.md",
      "recommended_adapter": "adapter-technical-blog",
      "primary_language": "ko",
      "categories": [
        "technical-blog"
      ],
      "target_audience": "developers"
    },
    {
      "slug": "buildhop",
      "path": "knowledge/platforms/buildhop.md",
      "recommended_adapter": "adapter-launch",
      "primary_language": "en",
      "categories": [
        "launch"
      ],
      "target_audience": "startups"
    },
    {
      "slug": "canva-developers",
      "path": "knowledge/platforms/canva-developers.md",
      "recommended_adapter": "adapter-technical-blog",
      "primary_language": "en",
      "categories": [
        "technical-blog"
      ],
      "target_audience": "designers"
    },
    {
      "slug": "chaos-computer-club",
      "path": "knowledge/platforms/chaos-computer-club.md",
      "recommended_adapter": "adapter-community-discussion",
      "primary_language": "de",
      "categories": [
        "community-discussion"
      ],
      "target_audience": "developers"
    },
    {
      "slug": "codepen",
      "path": "knowledge/platforms/codepen.md",
      "recommended_adapter": "adapter-showcase",
      "primary_language": "en",
      "categories": [
        "showcase"
      ],
      "target_audience": "developers"
    },
    {
      "slug": "connpass",
      "path": "knowledge/platforms/connpass.md",
      "recommended_adapter": "adapter-community-discussion",
      "primary_language": "ja",
      "categories": [
        "community-discussion"
      ],
      "target_audience": "developers"
    },
    {
      "slug": "cosmos",
      "path": "knowledge/platforms/cosmos.md",
      "recommended_adapter": "adapter-community-discussion",
      "primary_language": "ja",
      "categories": [
        "community-discussion"
      ],
      "target_audience": "developers"
    },
    {
      "slug": "csdn",
      "path": "knowledge/platforms/csdn.md",
      "recommended_adapter": "adapter-technical-blog",
      "primary_language": "zh",
      "categories": [
        "technical-blog"
      ],
      "target_audience": "developers"
    },
    {
      "slug": "css-tricks",
      "path": "knowledge/platforms/css-tricks.md",
      "recommended_adapter": "adapter-technical-blog",
      "primary_language": "en",
      "categories": [
        "technical-blog"
      ],
      "target_audience": "developers"
    },
    {
      "slug": "daily-dev",
      "path": "knowledge/platforms/daily-dev.md",
      "recommended_adapter": "adapter-technical-blog",
      "primary_language": "en",
      "categories": [
        "technical-blog"
      ],
      "target_audience": "developers"
    },
    {
      "slug": "dev-community",
      "path": "knowledge/platforms/dev-community.md",
      "recommended_adapter": "adapter-technical-blog",
      "primary_language": "en",
      "categories": [
        "technical-blog"
      ],
      "target_audience": "developers"
    },
    {
      "slug": "developpez-com",
      "path": "knowledge/platforms/developpez-com.md",
      "recommended_adapter": "adapter-technical-blog",
      "primary_language": "fr",
      "categories": [
        "technical-blog"
      ],
      "target_audience": "developers"
    },
    {
      "slug": "devfest-mena",
      "path": "knowledge/platforms/devfest-mena.md",
      "recommended_adapter": "adapter-community-discussion",
      "primary_language": "ar",
      "categories": [
        "community-discussion"
      ],
      "target_audience": "startups"
    },
    {
      "slug": "devpost",
      "path": "knowledge/platforms/devpost.md",
      "recommended_adapter": "adapter-launch",
      "primary_language": "en",
      "categories": [